text,rating
"""CDC has now classified this disease as airborne and anybody within 15 ft can catch it.""",0
"""Monkeypox can lead to being paralyzed.""",0
"Monkeypox ""is now classified as a form of herpes.""",0
"Monkeypox ""typically last 2-4 months.""",0
"purportedly shows an article from The Atlantic about straight men being in a position to ""end the stigma surrounding monkey pox.""",0
CDC has now classified [monkeypox] as airborne and anybody within 15 ft can catch it; [it] is now classified as a form of herpes [...] lasts 2-4 months [and] can lead to being paralyzed,0
Monkeypox Is An Airborne Disease,0
"98% of all monkeypox cases have been transmitted by people who identify as gay and bisexual, or men who have sex with men (MSM).",0
Monkeypox is a sexually-transmitted disease (STD) transmitted by men having sex with men.,0
Monkeypox virus can survive on door handles and toilet seats for 120 years and can spread from 5 miles away.,0
"Monkeypox, unlike the coronavirus diseases 2019, is ""not particularly fatal.""",0
"purportedly shows a tweet from Canadian Prime Minister Justin Trudeau in which he states he will be limiting his ""number of sexual partners to avoid spreading monkeypox.""",0
The current monkeypox outbreak is a result of a lab leak from the Wuhan Institute of Virology.,0
Face masks are mandatory because of monkeypox,0
"“‘Monkeypox’ is only circulating in countries where the Pfizer vaccine has been distributed and is being used to advance a Technocratic Great Reset.""",0
"Monkeypox is being used to cover up the effects of the jabs. The more jabs you have had, the more your immune system is weakened.",0
"“‘#Monkypox has never spread like this before’. – Dr. Meryl Nass, former biological warfare epidemiologist discussing the possibility of the virus being a bioweapon…”",0
monkeypox virus was made in Wuhan’s lab,0
TheJournal.ie published an article claiming monkeypox can live on door handles and toilet seats for 120 years and can infect anyone from five miles away.,0
"purportedly shows an article published by TheJournal.ie with a headline that reads, ""Monkeypox can live on door handles and toilet seats for 120 years and can infect anyone from 5 miles away.""",0
Monkeypox is only circulating in countries where the Pfizer Covid-19 vaccine has been distributed.,0
Public health authorities are attempting to cover up Covid-19 vaccine-induced shingles by calling it monkeypox.,0
Ghana records cases of Monkeypox,1
monkeypox locking down gyms forcing face masks,0
"WHO has asked to ban the import of second-hand clothes from Europe, the USA, and Asia",0
shingles (herpes zoster) induced by Pfizer Covid vaccine cause monkeypox,0
Monkeypox spreads faster in men who have sex with men.,0
Monkeypox is not airborne so masking would not protect the wearer.,0
WHO urges ban on thrift clothes to halt spread of monkeypox,0
Monkeypox is shingles.,0
purportedly shows a World Health Organization (WHO) letter calling for a temporary freeze on clothing imports and exports due to monkeypox.,0
Bill Gates has prepared billions of monkeypox vaccines,0
Monkeypox has been detected in all countries where there are no monkeys.,0
Monkeypox is a side effect of Pfizer's Covid-19 vaccine,0
FDA approved the Pfizer vaccine for monkeypox.,0
"Monkeypox and shingles are the same disease, caused by vaccine",0
“U.S. Orders MILLIONS Of Smallpox Vaccines Amid Global Monkeypox Outbreak.”,0
"“According to the WHO, the monkeypox pathogen strain was imported from Nigeria, where the US deployed its biological infrastructure""",0
Thailand reported 9 cases of monkeypox,0
The US Food and Drug Administration has approved a Pfizer monkeypox vaccine,0
Researchers from the Wuhan Institute of Virology (WIV) “assembled monkeypox strains”,0
Seems like shingles is being termed as monkeypox.,0
Monkeypox is linked to the chimpanzee virus used in the AstraZeneca Covid-19 vaccine,0
Chimp adenovirus in AstraZeneca's Covid-19 vaccine causes monkeypox,0
Recent monkeypox cases are in fact herpes infections.,0
Bill Gates planned a smallpox-type outbreak.,0
"13,783 cases of shingles, one of the adverse reactions of the Covid vaccines, are reported on the Vaccine Adverse Event Reporting System.",0
Covid-19 vaccines cause a form of AIDS which is causing people to exhibit symptomatic herpes.,0
claims the Food and Drug Administration (FDA) recently approved a vaccine for monkeypox produced by the pharmaceutical company Pfizer.,0
"Monkeypox is biological warfare being unleashed onto the public by the WHO, IMF and Bill Gates.",0
Monkeypox can spread only through homosexual men,0
Monkeypox is ‘vaccine acquired shingles’.,0
Monkeypox is a side effect of the Covid-19 vaccines.,0
Monkeypox is an autoimmune blistering disease and a suspected adverse event in the Pfizer safety document,0
The WEF meeting plan the monkeypox outbreak,0
Monkeypox a biological warfare waged by governments,0
"Animal hosts include a range of rodents and non-human primates In May 2022, multiple cases of monkeypox were identified in several non-endemic countries",1
"More than 18,000 cases of monkeypox have now been reported to WHO from 78 countries, with more than 70% of cases reported from the European region, and 25% from the region of the Americas",1
"Although 98% of cases so far are among men who have sex with men, anyone exposed can get monkeypox, which is why WHO recommends that countries take action to reduce the risk of transmission to other vulnerable groups, including children, pregnant women and those who are immunosuppressed",1
COVID-19 deaths have been increasing for the last five weeks and several countries are reporting increasing trends in hospitalisations following waves of transmission driven by Omicron subvariants,1
"8 in some European countries where, as the Director-General has already indicated, 99% of cases are still among men and, of those, over 95-98% are among men who have sex with men",1
"Today, the MedAccess and the Clinton Global Health Initiative announced that they negotiated a price of $1",1
There is no comparison but Mexico is one of the countries with one of the highest number of deaths because they did not take COVID seriously,1
"More than 18,000 cases of monkeypox have now been reported to WHO from 78 countries, with more than 70% of cases reported from the European region, and 25% from the region of the Americas",1
"Although 98% of cases so far are among men who have sex with men, anyone exposed can get monkeypox, which is why WHO recommends that countries take action to reduce the risk of transmission to other vulnerable groups, including children, pregnant women and those who are immunosuppressed",1
COVID-19 deaths have been increasing for the last five weeks and several countries are reporting increasing trends in hospitalisations following waves of transmission driven by Omicron subvariants,1
"8 in some European countries where, as the Director-General has already indicated, 99% of cases are still among men and, of those, over 95-98% are among men who have sex with men",1
"Today, the MedAccess and the Clinton Global Health Initiative announced that they negotiated a price of $1",1
There is no comparison but Mexico is one of the countries with one of the highest number of deaths because they did not take COVID seriously,1
"At the time, 3,040 cases of monkeypox had been reported to WHO from 47 countries",1
"Since then, the outbreak has continued to grow, and there are now more than 16,000 reported cases from 75 countries and territories, and five deaths",1
"I think, first, when we look at the demand situation of one of the countermeasures, the MVA-BN vaccine, we know that from the countries that are reporting cases at the moment, roughly half of them have already secured access to this vaccine",1
We have roughly 1 million of those already in a fill and finish situation,1
"And thirdly, on the so-called second-generation vaccine, ACAM2000, we know that roughly 100 million doses of this vaccine exist with various Member States in their national stockpiles",1
"So again, over the course of time, the countries, one country in particular in West Africa experienced a significant outbreak of monkeypox for the first time in 40 years, and that outbreak was managed by the country, but in fact, the cases never really completely went to zero",1
"In that situation, 20% to 30% are women and girls, and only two thirds to three quarters of the cases are among men and boys",1
"At the time, 3,040 cases of monkeypox had been reported to WHO from 47 countries",1
"Since then, the outbreak has continued to grow, and there are now more than 16,000 reported cases from 75 countries and territories, and five deaths",1
"I think, first, when we look at the demand situation of one of the countermeasures, the MVA-BN vaccine, we know that from the countries that are reporting cases at the moment, roughly half of them have already secured access to this vaccine",1
We have roughly 1 million of those already in a fill and finish situation,1
"And thirdly, on the so-called second-generation vaccine, ACAM2000, we know that roughly 100 million doses of this vaccine exist with various Member States in their national stockpiles",1
"So again, over the course of time, the countries, one country in particular in West Africa experienced a significant outbreak of monkeypox for the first time in 40 years, and that outbreak was managed by the country, but in fact, the cases never really completely went to zero",1
"In that situation, 20% to 30% are women and girls, and only two thirds to three quarters of the cases are among men and boys",1
"At the time, 3040 cases of monkeypox had been reported to WHO, from 47 countries",1
"Since then, the outbreak has continued to grow, and there are now more than 16 thousand reported cases from 75 countries and territories, and five deaths",1
"Presentations The WHO Secretariat presented the global epidemiological situation, highlighting that between 1 January 2022 and 20 July 2022, 14,533 probable and laboratory-confirmed cases (including 3 deaths in Nigeria and 2 in the Central African Republic) were reported to WHO from 72 countries across all six WHO Regions; up from 3,040 cases in 47 countries at the beginning of May 2022",1
"Transmission is occurring in many countries that had not previously reported cases of monkeypox, and the highest numbers of cases are currently reported from countries in the WHO European Region and the Region of the Americas",1
"There has also been a significant rise in the number of cases in countries in West and Central Africa, with an apparent difference in the demographic profile maintained than that observed in Europe and the Americas, with more women and children amongst the cases",1
"The Secretariat noted that, although the number of cases and countries experiencing outbreaks of monkeypox appear to be rising, the WHO risk assessment has not changed since the first meeting of the Committee on 23 June 2022, and the risk is considered to be “moderate” at global level and in all six WHO Regions, except for European region, where it is considered to be “high”",1
"With the exception of Nigeria, the remaining four countries reported that 99% of cases were occurring in MSM, and mainly among those with multiple partners",1
"In Spain, cases have been decreasing over the past few weeks, but it is likely the data are incomplete because of delays in reporting",1
Nigeria recorded a little over 800 cases of monkeypox between September 2017 and 10 July 2022 and has seen at 3% case fatality ratio among confirmed cases,1
Cases are predominantly in men aged 31 to 40 years; there was no evidence of sexual transmission presented,1
The highest number of annually reported cases since 2017 has been observed in 2022,1
"Of the nine considerations put forward, based on currently available data, two of them have seen a significant change since the previous meeting – an increased number of countries reporting the first case(s) of monkeypox, and an increase of the number of cases in some West and Central African countries",1
Secondary transmission to some children and women was reported,1
"Meanwhile, your Secretariat remains totally focused on continuing to support Member States to respond to the global health emergency that I declared two-and-a-half years ago – the COVID-19 pandemic",1
"Since October 2021, when our COVID-19 vaccination strategy was released, coverage has increased by more than 40% in lower-middle income countries, and by 15% in lower-income countries",1
25 million children missed out on basic vaccines last year,1
"More than 14,000 cases from 71 Member States across all six WHO regions have now been reported to WHO this year",1
"It’s pleasing to note an apparent declining trend in some countries, but others are still seeing an increase, and six countries reported their first cases last week",1
"One in every 8 people on our planet is a refugee or migrant, and the numbers are growing",1
"On monkeypox, almost 14 thousand confirmed cases have now been reported to WHO this year, from more than 70 countries and territories",1
"Although we are seeing a declining trend in some countries, others are still seeing an increase, and six countries reported their first cases last week",1
"Today, WHO released the first-ever report on vaccines in development to prevent infections caused by antimicrobial resistant bacterial pathogens",1
Four out of six of the WHO sub-regions saw cases increase in the last week,1
"Europe is the current epicentre of the outbreak, recording more than 80 percent of cases globally",1
"Finally, in Syria, the humanitarian needs are at their highest level since the war started 11 years ago",1
"Good morning, good afternoon and good evening, On COVID-19, globally reported cases have increased nearly 30% over the past two weeks",1
Four out of six of the WHO sub-regions saw cases increase in the last week,1
"Europe is the current epicentre of the outbreak, recording more than 80 percent of cases globally",1
"Finally, in Syria, the humanitarian needs are at their highest level since the war started 11 years ago",1
"5 million women and children, are in need of humanitarian assistance",1
"5 in many places, cases are on the rise in 110 countries, causing overall global cases to increase by 20% and deaths have risen in three of the six WHO regions even as the global figure remains relatively stable",1
"So let’s review: In the past 18 months, more than 12 billion vaccines have been distributed around the world",1
75 percent of the world’s health workers and over-60s are now vaccinated,1
The Lancet estimates that 20 million lives have been saved because of vaccines,1
"Over 80 million people, one in four, in the Eastern Africa region are food insecure and resorting to desperate measures in order to feed themselves and their families",1
"Outbreak at a glance Since 1 January and as of 22 June 2022, 3413 laboratory confirmed cases and one death have been reported to WHO from 50 countries/territories in five WHO Regions",1
"Since the previous Disease Outbreak News of 17 June was published, 1310 new cases have been reported and eight new countries have reported cases",1
"Only a relatively small number of military, frontline health professionals and laboratory workers have been vaccinated against smallpox in recent years",1
"The WHO Secretariat presented the global epidemiological situation, highlighting that since the beginning of May 2022, 3040 cases have been reported to WHO from 47 countries",1
"Transmission is occurring in many countries that have not previously reported cases of monkeypox, and the highest numbers of cases are currently reported from countries in the WHO European Region",1
"Since the last Emergency Committee (EC) meeting in February 2022, Pakistan has reported ten WPV1 cases from North Waziristan and two WPV1 positive environmental samples from the neighboring district of Bannu",1
"6 million previously unreached children have been vaccinated, and the number of children not yet accessed by immunization teams was down to an estimated 700,000",1
"High levels of transmission of cVDPV2 are occurring in northern Yemen, northern Nigeria, and eastern DR Congo, which have reported 115 out of 127 cases to date in 2022",1
"Since then, more than 3200 confirmed cases of monkeypox, and one death, have been reported to WHO, from 48 countries including Nigeria, and in five WHO regions",1
"Outbreak at a glance Since 1 January 2022, cases of monkeypox have been reported to WHO from 42 Member States across five WHO regions (the Regions of the Americas, Africa, Europe, Eastern Mediterranean, and Western Pacific)",1
"Description of the outbreak Between 1 January to 15 June 2022, a cumulative total of 2103 laboratory confirmed cases, one probable case, and one death have been reported to WHO from 42 countries in five WHO Regions",1
Reported cases and deaths have now both fallen more than 90% from their peaks earlier this year,1
"Still, more than 3 million cases were reported to WHO last week – and because many countries have reduced surveillance and testing, we know this number is under-reported",1
"Now to the Horn of Africa, where the worst drought in 40 years has pushed over 30 million people in eight countries into acute food insecurity: Djibouti, Eritrea, Ethiopia, Kenya, Somalia, South Sudan, Sudan, Uganda",1
"So far this year, more than 1,600 confirmed cases and almost 1,500 suspected cases of monkeypox have been reported to WHO from 39 countries – including seven countries where monkeypox has been detected for years, and 32 newly-affected countries",1
"So far this year, 72 deaths have been reported from previously-affected countries",1
"Since the beginning of 2022, 1536 suspected cases with 72 deaths were reported from eight countries as of 8 June 2022; 59 confirmed cases were reported from six countries during this same period (Table 2)",1
"As of 8 June, 1285 laboratory confirmed cases and one probable case have been reported to WHO from 28 countries in four WHO Regions where monkeypox is not usual or had not previously been reported",1
This represents an increase of 505 laboratory confirmed cases since the previous Disease Outbreak News on 4 June 2022 when 780 cases were reported,1
"Since 13 May 2022, cases of monkeypox have been reported to WHO from 28 Member States across four WHO regions (the Region of the Americas as well as the European, Eastern Mediterranean, and Western Pacific Regions) where monkeypox is not usual or has not previously been reported (Figure 1)",1
"In addition, since the beginning of the year, there are 1536 suspected cases reported from eight countries in the WHO African Region, of which 59 cases have been confirmed and 72 deaths reported",1
"Currently, the public health risk at the global level is assessed as moderate considering this is the first time that monkeypox cases and clusters are reported concurrently in many countries in widely disparate WHO geographical areas and without known epidemiological links to countries where monkeypox has been reported for many years",1
Some countries have maintained strategic supplies of older smallpox vaccines from the Smallpox Eradication Programme (SEP) which concluded in 1980,1
"On average, about three-quarters of health workers and people aged over 60 globally have been vaccinated",1
More than seven thousand people lost their lives to this virus last week – that’s seven thousand too many,1
More than one thousand confirmed cases of monkeypox have now been reported to WHO from 29 countries that are not endemic for the disease,1
"At the same time, we must remember that so far this year there have been more than one thousand four hundred suspected cases of monkeypox in Africa, and 66 deaths",1
"This represents an increase of 523 laboratory confirmed cases (+203%) since the Disease Outbreak News of 29 May, when a total of 257 cases were reported",1
"From January to 1 June 2022, 1408 suspected and 44 confirmed cases including 66 deaths were reported from seven endemic countries (Table 2)",1
"More than 550 confirmed cases have now been reported to WHO, from 30 countries that are not endemic for monkeypox virus",1
"There is a high risk of famine and malnutrition, severely affecting an estimated 15 to 20 million people in Kenya, Somalia, and Ethiopia",1
"More than 6 million people remain under siege by Ethiopian and Eritrean forces, after more than 18 months",1
"Tobacco use continues to decline, and 60 countries are on track to achieve the target of a 30% reduction in tobacco use by 2025",1
"More than 100 countries have now mandated graphic health warnings on tobacco packaging, 18 countries have introduced plain packaging, and another 9 are on the way",1
"A new WHO study has found that every year, the tobacco industry costs the world 600 hundred million trees, 84 million tonnes of CO2 emissions, 200 hundred thousand hectares of land, and 22 billion tonnes of water",1
"Currently, the Democratic Republic of the Congo is reporting a CFR among suspected cases of around 3%",1
Almost one billion people in lower-income countries remain unvaccinated,1
Only 57 countries have vaccinated 70% of their population – almost all of them high income,1
"But as you know, our new estimates of excess mortality are much higher – almost 15 million deaths",1
And reported deaths are at their lowest since March 2020,1
"There’s no question we have made progress, of course we have: 60% of the world’s population is vaccinated, helping to reduce hospitalizations and deaths, allowing health systems to cope, and societies to reopen",1
Reported cases are increasing in almost 70 countries in all regions – and this in a world in which testing rates have plummeted,1
Only 57 countries have vaccinated 70% of their population – almost all of them high-income countries,1
"It’s no coincidence that in 2018, the Ebola outbreak in the relatively stable Equateur province of DRC took two months to control, while the outbreak in the insecure regions of North Kivu and Ituri took two years",1
"So far this year, WHO has verified 373 attacks on health in 14 countries and territories, claiming the lives of 154 health workers and patients, and leaving 131 injured",1
"Genome sequence from a swab sample from a confirmed case in Portugal, indicated a close match of the monkeypox virus causing the current outbreak, to exported cases from Nigeria to the United Kingdom, Israel and Singapore in 2018 and 2019",1
"Cases of monkeypox in non-endemic countries reported to WHO between 13 to 21 May 2022 as at 13:00 As of 21 May, 13:00, 92 laboratory confirmed cases, and 28 suspected cases of monkeypox with investigations ongoing, have been reported to WHO from 12 Member States that are not endemic for monkeypox virus, across three WHO regions (Table 1, Figure 1)",1
"Since 13 May 2022, cases of monkeypox have been reported to WHO from 12 Member States that are not endemic for monkeypox virus, across three WHO regions",1
"Good morning, good afternoon and good evening, Over the last week, COVID-19 cases have risen in four out of the six WHO regions",1
Last year we saw the lowest number of cases of wild poliovirus with just two countries still endemic,1
"The first imported human case in a traveler from Nigeria was reported on 15 July 2021 (for more information on the first case, please see the Disease Outbreak News published on 27 July 2021)",1
"In addition to these two cases, since 2018, six importations of human cases of monkeypox have been reported in non-endemic countries in travelers from Nigeria to Israel (one case), Singapore (one case) and the United Kingdom of Great Britain and Northern Ireland (four cases)",1
A case fatality ratio of up to 11% (in individuals without prior smallpox vaccination) has been reported for the Congo basin clade,1
"However, the vast majority of cases continue to be reported in the Democratic Republic of the Congo, with 2780 cases and 72 deaths (CFR 2",1
"In 2020, over 6200 suspected cases were reported in the Democratic Republic of the Congo",1
"Since 2018, six cases have been reported and confirmed in non-endemic countries via travelers to Israel (2018), Singapore (2019), and the United Kingdom of Great Britain and Northern Ireland (two cases in 2018, one in 2019 and one in 2021)",1
"As of 25 July, over 200 persons are being monitored in the USA and none have developed symptoms consistent with monkeypox",1
"As of 15 May 2019, 14 persons were vaccinated",1
"Currently in the United Kingdom, including these two cases, there have been only six cases of monkeypox reported, including three previously imported cases from Nigeria, two in September 2018 and one in December 2019",1
"In 2017, Nigeria began to experience its first outbreak in 40 years",1
"From the first cases in September 2017 to November 2019, a total of 183 confirmed cases and 9 deaths were recorded in 18 states (Rivers, Bayelsa, Cross River, Imo, Akwa Ibom, Lagos, Delta, Bauchi, Federal Capital Territory (FCT), Abia, Oyo, Enugu, Ekiti, Nasarawa, Benue, Plateau, Edo, Anambra)",1
"In 2020, there were 14 suspected cases, three confirmed cases and no deaths",1
"Of the suspected cases, 7 were confirmed from five states Delta (2), Bayelsa (2), Lagos (1), Edo (1), Rivers (1) and no deaths were recorded",1
"Importations of monkeypox from an endemic country to another country not previously known to have cases have been documented on a total of eight, once in 2003 and the rest since 2018",1
"Disease Outbreak Reported Increased activity of monkeypox was reported in Katako-Kombe health zone, Sankuru sub-region, Kasai Orental during 1997 (see Weekly Epidemiological Record No",1
