text,rating
"Samples were obtained from 11 cases all of which were subsequently confirmed as monkeypox by the WHO Collaborating Centre for Smallpox and other Poxvirus Infections at the Centers for Disease Control and Prevention (CDC) in Atlanta, USA",1
Concern about the unusual high number of cases and the apparent increased transmission between human cases triggered a multidisciplinary investigation in February 1997,1
"14 April 1997 Disease Outbreak Reported Following reports of ongoing cases of human monkeypox in Zaire representing a new pattern of the disease, the Ministry of Health in Zaire and the World Health Organization (WHO) organized an investigation in February 1997",1
"The study revealed that this outbreak represents the largest cluster of monkeypox cases ever reported, and the proportion of patients that were 15 years of age or older (27%) was higher than previously reported (8%)",1
"However, the recent study has shown that active cases in February 1997 were linked to cases that occurred during the preceding 12 month period",1
"31 July 1997 Disease Outbreak Reported The increased activity of monkeypox which occurred in Katako-Kombe health zone, Sankuru sub-region, Kasai Oriental Region during 1997 (see Weekly Epidemiological Record No",1
"During the period March to May 1997, 170 cases suspected to be monkeypox were reported: 58 in March, 52 in April and 60 in May",1
Most (134/170) cases were in children under 16 years of age,1
"Katako-Kombe, where the outbreak was first registered in 1997, accounted for 112 of the cases which occurred during March, April and May 1997",1
The remaining 58 cases occurred in neighbouring Lodja Nord (47 cases) and Lodja Sud (11 cases),1
"Disease Outbreak Reported The WHO team investigating the extended outbreak of human monkeypox continued its mission in Kasai Oriental, Democratic Republic of the Congo in October 1997",1
"The team identified 419 suspect cases fitting the case definition of a possible or probable case, which, together with those identified in previous surveys, amounts to a total of 511 suspect cases of human monkeypox reported since February 1997",1
"The highest number of suspect cases were in outbreaks in Akungula in August 1997, in Ekanga and neighbouring villages in March 1997 and several other villages in August 1997",1
"Of the 419 suspect cases identified by the team in October 1997, 344 occurred in the Katako Kombe health zone and 75 in the Lodja health zone",1
Most (85%) of the 344 suspect cases resident in the Katako-Kombe zone were in children under 16 years of age,1
Ten were hospitalised for up to 30 days and 54% were incapacitated for more than three days,1
"Twenty-two per cent of the 419 suspect cases identified during this mission were primary, the remainder were defined as secondary",1
"Primary cases with no apparent connection to Akungula and Ekanga villages, were reported from 49 of the total 78 villages where cases were found",1
Thirty-five per cent of the 419 cases reported being outside their home village in the three weeks before disease onset - the majority in the forest,1
"Laboratory-confirmed cases were reported from fourteen states (out of 36 states)/territory: Akwa Ibom, Abia, Bayelsa, Benue, Cross River, Delta, Edo, Ekiti, Enugu, Lagos, Imo, Nasarawa, Rivers and Federal Capital Territory (FCT)",1
"Suspected cases were reported from 23 states/territories including: Abia, Adamawa, Akwa Ibom, Bayelsa, Benue, Cross River, Delta, Edo, Ekiti, Enugu, Federal Capital Territory (FCT), Imo, Kaduna, Kano, Katsina, Kogi, Kwara, Lagos, Ondo, Oyo, Nasarawa, Niger, and Rivers",1
"5 June 2018 From 30 April through 30 May 2018, a total of 16 confirmed and suspected cases (one confirmed and 15 suspected cases) were reported to the Directorate of Control of Epidemic and Pandemic diseases (DLMEP)",1
"From the onset of the outbreak in September 2017 through 15 September 2018, a total of 269 suspected cases across 25 states and one territory, including 115 confirmed cases across 16 states and one territory, have been reported",1
"Seven deaths were recorded, four of which were in patients with a pre-existing immunocompromised condition",1
"These cases were reported in 14 states and one territory (Abia, Akwa-Ibom, Anambra, Bayelsa, Cross River, Delta, Edo, Enugu, Imo, Lagos, Nasarawa, Oyo, Plateau and Rivers and the Federal Capital Territory (FCT))",1
"From 1 January through 13 September 2020, a total of 4,594 suspected cases of monkeypox, including 171 deaths (case fatality ratio 3",1
"7%), have been reported in 127 health zones from 17 out of 26 provinces in the Democratic Republic of the Congo",1
"The first epidemic peak was observed at the beginning of March 2020 (epi week 10), with 136 cases reported weekly (Figure1)",1
"From 1 January through 7 August, the Institut National de Recherche Biomédicale (INRB) received 80 samples from suspected cases of monkeypox, of which 39 samples were confirmed positive by polymerase chain reaction",1
"9%) were reported in 120 health zones from 16 provinces while a total of 2,850 suspected cases (CFR 2",1
"From 1 January to 13 September, Kwilu province is reporting the highest case fatality ratio of 16",1
The outbreak in Inongo health zone (Mai-Ndombe province) is one of the most concerning outbreaks where one-fourth of its territory is affected,1
"Source: Integrated Disease Surveillance (IDS) Report for the Democratic Republic of the Congo, Epidemiological Week 37, 2020 Monkeypox cases were reported in health zones which are also experiencing multiple disease outbreaks, including measles, polio due to cVDPV, malaria, cholera, and COVID-19, in addition to an ongoing Ebola virus disease outbreak in Equateur Province which continues to experience armed conflict and violence",1
"As of 16 September 2020, a total of 10,401 cases of COVID-19 including 267 deaths were reported in the DRC",1
"Monkeypox due to the Congo Basin clade virus has seen reported mortality of up to 10% of cases, whereas the West African clade usually displays fatal outcomes in less than 1% of cases",1
"Globally, there are more than 13 million children, many of them in fragile states and conflict-affected countries, who are entirely left out of vaccination services",1
"Since the outbreak started last August there have been 2,108 cases of Ebola and 1,411 deaths",1
"The budget for preparedness in the four most at-risk countries was over $60 million, nearly $70 but there's still a gap in that funding of $27 million as we speak and that's through to the end of June",1
"Since 2017, Nigeria has experienced a large outbreak, with over 500 suspected cases and over 200 confirmed cases and a case fatality ratio of approximately 3%",1
"However, the longest documented chain of transmission in a community has risen in recent years from 6 to 9 successive person-to-person infections",1
Smallpox was more easily transmitted and more often fatal as about 30% of patients died,1
It has been 40 or more years since all countries ceased routine smallpox vaccination with vaccinia-based vaccines,1
